{
  "capture_file": "transactions.jsonl",
  "limitations": [
    "2 open or partial transaction(s) observed"
  ],
  "open_transactions": [
    {
      "capture_file": "transactions.jsonl",
      "connection_context": "tcp-stream:0",
      "correlation_strength": "PARTIAL",
      "limitations": [
        "request observed without matching response frame in capture"
      ],
      "method": "POST",
      "operation": "CreateSMContext",
      "path": "/nsmf-pdusession/v1/sm-contexts",
      "request_frames": [
        301
      ],
      "response_frames": [],
      "service": "Nsmf_PDUSession",
      "sm_context_ref": null,
      "status": null,
      "stream_id": 1,
      "transaction_key": "sbi-tx:transactions.jsonl:tcp-stream:0:stream1",
      "transport_error": null
    },
    {
      "capture_file": "transactions.jsonl",
      "connection_context": "tcp-stream:0",
      "correlation_strength": "PARTIAL",
      "limitations": [
        "response observed without preceding request frame in capture"
      ],
      "method": null,
      "operation": null,
      "path": null,
      "request_frames": [],
      "response_frames": [
        302
      ],
      "service": null,
      "sm_context_ref": null,
      "status": 204,
      "stream_id": 3,
      "transaction_key": "sbi-tx:transactions.jsonl:tcp-stream:0:stream3",
      "transport_error": null
    }
  ],
  "transactions": [
    {
      "capture_file": "transactions.jsonl",
      "connection_context": "tcp-stream:0",
      "correlation_strength": "STRONG",
      "limitations": [],
      "method": "POST",
      "operation": "UpdateSMContext",
      "path": "/nsmf-pdusession/v1/sm-contexts/ctx-5/modify",
      "request_frames": [
        303
      ],
      "response_frames": [
        304
      ],
      "service": "Nsmf_PDUSession",
      "sm_context_ref": "ctx-5",
      "status": 200,
      "stream_id": 5,
      "transaction_key": "sbi-tx:transactions.jsonl:tcp-stream:0:stream5",
      "transport_error": null
    }
  ],
  "unbound_events": []
}
